Emil's Lounge; Bars,American (New),Nightlife,Lounges,Restaurants;Love my hometown favorites. Cannot beat their fish sandwiches (although I do miss the buns as opposed to the sliced bread...stop that). Always will support Emil's\nOther favorites include Reuben, Hawkins Avenue sandwich, Chrissy Club.
Emil's Lounge; Bars,American (New),Nightlife,Lounges,Restaurants;Emil's is a great place to eat! The prices are VERY reasonable, the portions are HUGE and everything I have ever ordered has been tasty and well prepared. The people who work there are so friendly, as are the customers who eat there. Ample free parking makes it easy to go there. I didn't worry about the area- the police station is right across the street. Don't leave the Burgh without having (1) their fish sandwich, and (2) their Reuben. You will be glad you ate there!
Emil's Lounge; Bars,American (New),Nightlife,Lounges,Restaurants;I love everything about this place. The food is delicious (yes yes, the fish sandwiches, OK, I agree -- but DID YOU TRY THE MEATBALLS?? holy tamoley), I adore the staff, and I love that there are no windows -- it's its own little hermetically sealed 1950s world of delicious, real food and good people. Lots of places try to create this kind of ambiance, but it can't be manufactured. It takes decades of good food and good vibes.\n\nAlso, the food is really good. 
Emil's Lounge; Bars,American (New),Nightlife,Lounges,Restaurants;I had a hankering for some fried fish tonight and the fish fry at Maximilian Kolbe was going to close before I got home on the bus, and I suggested to my wife and 12 year-old daughter that we try Emil's lounge as WQED's Rick Seback loved the place as did Andrew Zimmern when he visited for the Bizarre Foods America episode featuring Pittsburgh.  \n\nThe place is in Rankin - a rough around the edges town in the Mon Valley between Swissvale and Braddock.  Don't be put off at first - the outside doesn't have much decoration to speak of and looks like the sort of place that you might think twice about it.  A TGI Fridays it isn't... And thank god for that.\n\nThe place is well-kept but a little dated -  no fripperies here.  But we're not here for the Decor - we're here for some dinner.  \n\nThe menu is basic with reasonable prices.  The meats and seafood are high quality and everything is made to order.  Their stuffed cabbage is regarded as the best in  Pittsburgh.  I love stuffed cabbage but I just made a batch a couple of weeks ago and I'm cabbaged out.  Their Ruebens are   also killer (our waitress raved about them).  My wife and I both settled on fish sandwiches.  These are true Pittsburgh fish Sammiches - fresh fried fish in crispy breading, crammed between enormous pillows of soft, yet chewy and crispy Mancini's Italian bread.  No adornments - just a boatload of hot crispy fish.  Emil's uses thick cod fillets piled high rather than a thin fillet that needs to be broken up to fit in the bun.  Truly a great sandwich.  My daughter had the BLT - looked good and on good bread and they weren't skimpy with the bacon.\n\nThe service was very pleasant and friendly and the crowd was a great group of folks.  We all had fun with 4 other tables when my wife pulled up a Trivial Pursuit game on her iPhone and pretty much everyone joined in and had a good laugh.\n\nOverall, if you consider yourself a true Pittsburgher - you must visit this place.  It's one of the few places (Big Jim's in the Run is another) where the spirit of Pittsburgh is alive and hungry.  Please go.
Emil's Lounge; Bars,American (New),Nightlife,Lounges,Restaurants;We have been coming here for over 30 years, consistantly good food and friendly staff. Vwey reasonably priced and large portions. The owner, Chrissy has taken what Emil started years ago and built it into a place we will return to again and again. Favorites are the fish and burgers, hard to pick one!
Emil's Lounge; Bars,American (New),Nightlife,Lounges,Restaurants;We had gone to the Frick Mansion for a tour and I told my friends we were stopping off for a lunch in Rankin. There wasn't much enthusiasm about the location but the reluctantly agreed.  We stopped in front and my wife said we aren't going in there are we? Well once the order the food and enjoyed the best Reuben,  fish sandwich and stuffed peppers they were sold. The owner came over and thanked us for stopping. She is a real asset to the place. The restrooms were spotless, which important to my wife. I have taken places where she had to hover  over the commode. I went back two days later for the hulushki. A real gem a perfect place to eat real comfort food. Don't forget the liver and onions.
Emil's Lounge; Bars,American (New),Nightlife,Lounges,Restaurants;Excellent fish sandwich, Wonderful Reuben Sandwich, even the stuffed cabbage tastes homemade.   Chrissy \nIs a delightful hostess and makes you feel welcome.  Restaurant personnel are pleasant.   I really enjoy visiting Emils when I'm in town   My only regret is that they are closed Mondays.   Worth the trip
Emil's Lounge; Bars,American (New),Nightlife,Lounges,Restaurants;I wouldnt say the best fish sandwich ive ever had...definitely a huge portion but rather bland and nothing special. Very nice people and good service but i would largely disagree with most of the reviews here. Atmosphere was quite drab, classic western pa corner bar but no windows, poorly lit, and overall fairly dismal.... Clientele seemed to be on deaths door, missing limbs and morbidly obese. Fries were frozen and under cooked. Meatballs were dry and bland as well. I had high hopes but left feeling disappointed, defeated, bloated and like i had swallowed the entire rustbelt in one bite...'), 
Emil's Lounge; Bars,American (New),Nightlife,Lounges,Restaurants;This is my fourth time but my first review. It never disappoints! Always home cooking, old school like grandma's house. Don't expect ambiance, but if you're hungry and want nice wait staff, (usually family) squeaky clean, great value and generous portions-way more than I can ever finish, Emil's is your place.\n\nTonight I had a cup of the chicken dumpling soup that was sooooo good! Very obviously home made. I had a side of onion rings that were perfectly cooked, which doesn't sound fancy, but I still couldn't finish. My husband had the chicken parm. Thursday is Italian night. It came with a huge salad, very fresh, an entire loaf of Italian bread, and a generous portion of nicely crisped and tender chicken breasts. Added to that, a side helping of ziti. My husband enjoyed it very much, the chicken was perfectly cooked. I'm a sauce snob, Italian, allergic to with an aversion to green peppers. To me, there was just a hint of green pepper in the sauce so I probably would avoid anything with red sauce at Emil's but that's just my quirk. I've had the stuffed cabbages there, the fried fish, Ruebens, burgers - all wonderful! Emil was and his family is of Serbian decent. Food is love. We love Emils!
Emil's Lounge; Bars,American (New),Nightlife,Lounges,Restaurants;I remember the old man 20 years ago eating a giant size hamburger used asked me questions I miss those days food there is spectacular the fish is to die at four if you never been there just put it on your schedule of your things to do and I promise you you won't be sorry.
Emil's Lounge; Bars,American (New),Nightlife,Lounges,Restaurants;Great food  & service every visit. They do so many things right there especially taking care of the customers.  I have always received a hello, a follow up on my food, a thank you and then a good bye.  Some many restaurants get away from these simple steps of service. I'm glad Emil's has not.
Emil's Lounge; Bars,American (New),Nightlife,Lounges,Restaurants;This is our second time here in two weeks.  We have always liked Emil's, but just haven't been out this way lately.  This is now going to change.  Last week we had the wonderful fish - it has always been good.  Last week we stopped on a Tuesday after golf.  The bartender recommended the special of the day - the Chicken Romano with garlic and olive oil pasta.  It was truly outstanding!  I can't wait to go back and have it again!  The homemade Tomato soup with Asiago cheese was delicious as well.  Thanks Chef Tony!
Emil's Lounge; Bars,American (New),Nightlife,Lounges,Restaurants;Chicken Romano (yes, again - it's that good). My husband had the Shrimp stuffed with crab - wow! Love, love! Thanks KK, great suggestions!