Grand View Golf Club; Active Life,Golf; I like this course. It's always very well maintained. The carts are in excellent shape, all electric and all equipped with GPS. The greens fees are extremely reasonable and many of the holes are challenging, even if you are a better golfer. It truly has a grand view up and down the Mon, from the Triangle and the Cathedral of Learning to Braddock, the Edgar Thompson Works, Kennywood and beyond. Yet, when you go a few more feet on the cart path, you are in the woods, alone with the abundant wildlife. One caveat- bring an abundant supply of balls. If you golf like I do, one sleeve will not be enough
Grand View Golf Club; Active Life,Golf; 2nd time playing here. Was in the area for a bowling tournament so a group of us decided to come early and get a round of golf in. The course is hilly and challenging with readable and fairly flat greens. But, as the name suggests, what a Grand View of both the course as well as the surrounding areas. \nCarts are in excellent shape and provide you with electronic scoring and course GPS.  The folks here take pride in their course and take very good care of it.
Grand View Golf Club; Active Life,Golf; Challenging but fun course! Bring plenty of extra balls, I am a novice and lost at least 5. Carts are in great condition and remind you to stay on the cart path (sometimes annoying when looking for balls but safety first) and guide you to the next hole. The pro was very nice and patient with our group as we had to delay teeing off for an hour due to parkway closures. Driving range is nothing to write home about but gets the job done for warming up. Beautiful views and lots of variety of length and layout of holes. I'll definitely be back!
Cool Springs Golf Center;Active Life, Mini Golf, Golf;Decent range somewhat close to the city.  The mats are pretty solid; however, the grass range needs to be tended too.  It's like hitting out of US Open type rough...not very amenable to practicing.  Which kind of defeats the purpose of going to a golf range...Still gets 3 stars because the range is lit up at night which is excellent for those of us who are addicted to this amazing game, but are somewhat short on time (having a job kinda sucks sometimes, no?).
Cool Springs Golf Center;Active Life, Mini Golf, Golf;Owning a driving range inside the city limits is like a license to print money.  I don't think I ask much out of a driving range.  Decent mats, clean balls and accessible hours.  Hell you need even less people now with the advent of the machine that doles out the balls.  This place has none of them.  It is april and there are no grass tees yet.  BTW they opened for the season this week although it has been golfing weather for a month.  The mats look like the carpet at my 107 year old aunt Irene's house.  Worn and thread bare.  Let's talk about the hours.  This place is equipped with lights yet they only sell buckets of balls until 730.  It is still light out.  Finally lets you have the pit to hit into.  When I arrived I wasn't sure if this was a driving range or an excavation site for a mastodon or a strip mining operation.  There is no grass on the range. Just mud.  Makes it a good tool to figure out how far you actually are hitting the ball.  Oh, they are cash only also.\n\nBottom line, this place sucks.  The best hope is that the owner sells it to someone that actually wants to make money and service golfers in Pittsburgh.")
Cool Springs Golf Center;Active Life, Mini Golf, Golf;This place is absolute garbage...  Half of the tees are not available, including all the grass tees.  It is cash only, and they sell the last bucket at 8, despite having lights.  And if you finish even a minute after 8, don't plan on getting a drink.  The vending machines are sold out (of course) and they sell drinks inside, but close the drawers at 8 on the dot.  There are weeds grown all over the place.  I noticed some sort of batting cage, but it looks like those are out of order as well.  Someone should buy this place and turn it into what it should be.
Cool Springs Golf Center;Active Life, Mini Golf, Golf;Before I finally made it over to this range I heard the same thing from most people - it's just fine to go work on your swing. I had such a low expectation I was pleasantly surprised. \n\nIt's a fairly big range - if you are familiar with Scally's in Moon, it seems like it has almost as many tees, though its not nearly as nice a facility. \n\nThe guys in the pro shop were two of the friendlier guys I've come across at ranges or at courses. Yards were indeed marked and there are some targets to aim for, and even some hazards to aim away from. \n\nA big red flag to me was the extra charge ($3) to hit off the grass. I am no range expert, but this is the 4th one I've been to and the first I've seen of that sort of nickel and diming....\n\nPrice for the golf balls was reasonable and I do plan to be back every week until they close up in October for the season. Hopefully, since its for sale, it will reopen as a golf facility again."), 
Cool Springs Golf Center;Active Life, Mini Golf, Golf;I drove by yesterday to get a sneak peak.  It re-opens on July 14th and I can't wait to take my kids.  The new range looks amazing.  The entire range appears to be turf, which may or many not help your game, but it looks really nice.  The tee boxes look state of the art and the club house looks like something you'll see on a newer course.  Can't wait to experience it!"
Forsythe Miniature Golf & Snacks;Active Life,Mini Golf;Most random location for a mini golf course ever.  This is old school. It's built into the woods (spray yourself for bugs first) right off Forsythe Rd near Carnegie Park.  The candy hut is fun to spend your spare change.  They recently re-carpeted the holes and added a few gimmicks that weren't there before.  It won't knock your socks off, but if you're local, give it a try!")
Forsythe Miniature Golf & Snacks;Active Life,Mini Golf;This quaint mini golf course is one of the oldest, yet most original and fun locations that I have yet visited.  Coming from Texas, it was nice to see a course located amongst the hilly and woody Pennsylvanian terrain. It can be frustrating that it is literally impossible to make a hole-in-one on most every hole and that the course also makes it extremely difficult to predict the direction on how the ball will follow through and bounce.  The cartoon-like outrageousness of the course proved to give laughs and a fun attempt to play.  Improvements were being made and I will look forward to returning on my next visit to the Pittsburgh area.  I enjoy traveling and visiting new courses and the only reason why I didn't give this location 5 stars is because it was impossible to intuitively shoot the ball for a best effort to beat par."), 
Forsythe Miniature Golf & Snacks;Active Life,Mini Golf;I think this place is closed. Their number is out of service, sign is gone and the course has not been maintained. Awesome woodsy mess of a course though!'
Forsythe Miniature Golf & Snacks;Active Life,Mini Golf;I've been informed by a fellow Yelper that they are just closed for the season, I hope they're right! I find it strange they don't keep their phone number in service with a recording and that they didn't cover the course up to protect it from weather, vandalism, etc. Either way, I can't wait to get my game on in the spring!"
Carnegie Free Library; Libraries, Public Services & Government; NICE, suppose to be haunted. In carnegie off main st. Closed Sunday during summer. During school season open some nights until 7pm.'
Carnegie Free Library; Libraries, Public Services & Government;Awesome historic building high on top of the hill in Carnegie. Home to stage 62, a theatre group that puts on musicals. I recently saw Sideshow and Evita here. Great sound and comfortable chairs, an all around pleasant experience for a pleasant evening or Sunday matinee. Plenty of free parking and at only 18 dollars its a true bargain. \n\nAnd yes, the rumors are true, this building is haunted.
Carnegie Free Library; Libraries, Public Services & Government;Beautiful restoration of the library and music hall.   Look forward to coming here for shows.
Mr Hoagie; Fast Food,Restaurants; Mr Hoagie is an institution. Walking in, it does seem like a throwback to 30 years ago, old fashioned menu board, booths out of the 70s, and a large selection of food. Their speciality is the Italian Hoagie, and it is voted the best in the area year after year. I usually order the burger, while the patties are obviously cooked from frozen, all of the other ingredients are very fresh. Overall, its a good alternative to Subway, which is down the road.'), 
Mr Hoagie; Fast Food,Restaurants; Excellent food. Superb customer service. I miss the mario machines they used to have, but it's still a great place steeped in tradition.
Mr Hoagie; Fast Food,Restaurants; Yes this place is a little out dated and not opened on the weekend. But other than that the staff is always pleasant and fast to make your order. Which is always spot on fresh veggies on their hoggies and other food. They also have daily specials and ice cream which is really good. I had a banana split they piled the toppings on. They win pennysaver awards ever years i see why.
Mr Hoagie; Fast Food,Restaurants; PROS: Italian hoagie was delicious.  Friendly counter employee. The restaurant was clean and neat. \n\nCONS: The pizza was not good.  Pre-formed crust, NOT fresh dough.  The price of the failure of a pizza WAS NOT CHEAP EITHER.  \n\nI guess the name says it all.  Get the hoagie, pass on the pizza.
Mr Hoagie; Fast Food,Restaurants; First the only reason this place could possibly win best hoagie is because there\'s no competition. Two hoagies and a side of onion rings cost $25.74\n\nSo I\'m thinking with the reader choice awards and $10 per 12" hoagie these will be awesome. \n\nI was sadly mistaken. \n\nThe only reason I didn\'t give one star is because is the bread & dressing is fairly decent. \n\nSo on to the hoagies, the Italian is general run of the mill. Minimal meat and a ton of shredded lettuce. You get more meat at subway. Nothing really special & NOT worthy of the $10 price tag. \n\nSecond, the steak hoagie, it is atrocious. \nNo cheese?!?!? You have to add cheese for $1 so now the steak hoagie is $11. That has so little amounts of meat that I thought I was eating a lettuce & onion hoagie. I am thoroughly disappointed with this hoagie, possibly the worst value of a hoagie I\'ve ever eaten. \nI\'m not say eating at subway is any better, but for the huge price difference you are better off doing so. \nCheck out pasquales down the road, better hoagie & price.
Mr Hoagie; Fast Food,Restaurants; Normally, I do not do reviews of an establishment unless the rating is exceptionally great or exceptionally bad.  If I had not felt sucker punched and mugged after I left Mr. Hoagie, I would not be writing this bad review.  On my first and last trip there, I paid $24.59 for two whole hoagies.  \n\n1) The Italian (ordered because the woman (she) working there told me it was their most popular hoagie) I ordered with lettuce and onions (no tomato, italian dressing which all come free with the hoagie).  I had to pay $1 to add cheese to the hoagie.  Because I was traveling and would not be eating the hoagie right away, I asked for the italian on the side.  She told me there was a charge for the dressing on the side.  I passed on that on principle.  Are you kidding me?  I just saved her money by declining the tomato.  I was not going to pay for the dressing on the side.  At this point, I am certain something is not right and this place appears to me to be in financial trouble.  That pales in comparison to what happened next.  I opened the hoagie and there were three microscopically thin slices of meat on this hoagie.  Ham, salami, and bologna.  Bologna!?!?!?!?    Who in the hell puts disgusting bologna on an Italian hoagie?  That disqualifies that hoagie as an Italian.  The red flags indicating this place is in financial trouble are blinding my view.  One area of this hoagie only had one slice of bologna, no ham and no salami.\n\n2)  The Steak hoagie came with nothing on it but lettuce, tomato, onions, and dressing.  I ordered it without lettuce, tomato, onions, or dressing.  I asked for mayo on the side.  I had to pay for that so I declined.  Are you kidding me?  I just saved them money by passing on the lettuce, tomato, fresh onions, and dressing!  I paid $3 to add saut\xe9ed mushrooms, onions, and cheese.  Here we go again.  Canned mushrooms that were not even cooked through (were still cold) and onions that were still crunchy/undercooked.  News flash:  you need to serve fresh mushrooms that have been saut\xe9ed (canned mushrooms are another sign this place is in financial trouble).  I literally had to open the hoagie to find the steak because I could not taste or see it.  The hoagie was 50% mushrooms, 30%onions, 10% cheese and 10% steak.\n\nI could have personally made 10 whole hoagies with substantial quality ingredients and toppings for the $24.59 I paid for these two whole hoagies.  I intentionally patronize non-chain restaurants to support small businesses.  In this case, Never. Again.  (The hoagie bun was better than average.)  Wake up or you are going to lose your business.
Mr Hoagie; Fast Food,Restaurants; I like this place a lot. It's a good toasted hoagie. I actually don't like a my bun exploding with meat, but as a previous poster mentioned if you do maybe you wouldn't like this place. The inside badly needs updated though. The staff is friendly.
Clancy's Pub; Nightlife;All the food is great here. But the best thing they have is their wings. Their wings are simply fantastic!!  The "Wet Cajun" are by the best & most popular.  I also like the seasoned salt wings.  Wing Night is Monday & Wednesday night, $0.75 whole wings!\n\nThe dining area is nice. Very family friendly! The bar is very nice is well.  This place is truly a Yinzer\'s dream!!  "Pittsburgh Dad" would love this place n\'at!!'
Clancy's Pub; Nightlife;We checked this place out this past Monday for their wing night. We have heard that their wings are great and decided it was finally time to check it out. Their wings are whole wings and crispy, which is a nice change of pace. I got their wet Cajun sauce and garlic butter wings. The Cajun did not have a bold enough flavor for me and their sauce is too thin. The sauce was also thin for the garlic butter, but that is more expected. They were better than average, but I don't like seeing all the sauce resting at the bottom of the boat. I would definitely come try this place out again to sample some of the other items on the menu, but this will probably not become a regular stop for wings anytime soon."), 
Clancy's Pub; Nightlife;Wing sauce is like water. Pretty much a lot of butter and some hot sauce (franks red hot maybe).  The whole wings are good size and crispy, but for $1 a wing the sauce could be better. The hot and extra hot are about the same flavor/heat.  The fish sandwich is good and is a large portion, sides are decent.'), 
Clancy's Pub; Nightlife;Cold cheap beer. Good bar food. Good service. \n\nLooking for a great Pittsburgh style fish sandwich, this is the place to go. The breading is light, fish is more than plentiful and a good side of home cut fries. \n\nGood grilled chicken salads or steak.  Soup of day is homemade and lots of specials. Great place for lunch or bar snacks and beer.
Clancy's Pub; Nightlife;Possibly the most overhyped establishment in Allegheny County. If you're not a regular, you will be ignored by those who're tending bar. Beer selection is okay, the prices are good and the service is terrible. I would go here, but only if it was someone else's idea.
Emil's Lounge; Bars,American (New),Nightlife,Lounges,Restaurants;This place was DELICIOUS!!  My parents saw a recommendation to visit this place from Rick Sebak\'s "25 Things I Like About Pittsburgh" and he\'s usually pretty accurate.  His recommendations were to try the Reuben, Fish Sandwich and Open-Faced Steak Sandwich.  We went early afternoon for a late lunch today (a Saturday) and were seated right away.  The staff is extremely friendly.  My Mom & I each had the fish sandwich, while my Dad & Brother had a Reuben sandwich.  The fish was very good, but the Reuben was to die for!  Both dishes were massive, and could very easily be shared between two people.  On top of being extremely large portions, it was incredibly affordable.  The giant fish sandwich was $8 and the giant Reuben was $7.50.  Our drinks were always filled and we were checked on several times during the meal.  We will definitely be back!!!  Oh and a bit of advice ahead of time - they take CASH ONLY.  So come prepared, but I\'m pretty sure I saw an ATM there as well.  And I do believe they are closed on Sundays & Mondays.
Emil's Lounge; Bars,American (New),Nightlife,Lounges,Restaurants; Can't miss stop for the best Fish Sandwich in Pittsburgh.
Emil's Lounge; Bars,American (New),Nightlife,Lounges,Restaurants;This place should have a lot more reviews - but I\'m glad it doesn\'t, they don\'t need to get any busier.\n\nIts been there ages, and looks it. If you\'re all about ambiance, don\'t bother. If you pretend you\'re in a movie set in Pittsburgh 30 years ago it works pretty well. The service is sometimes hit or miss. Most of girls are good, one is very slow, one is amazing. They are all friendly and usually a few different people will check in to make sure that you\'re happy. Everything is made fresh so be prepared that nothing comes flying out of that kitchen - busy times it can take a good while to get food. \n\nThe food is AWESOME! Worth any little complaints I might think up before it gets there. Once its on the table, I forget them all.\n\n-Fish Sandwiich\n-Salmon (huge and delicious)\n-Flounder\n-Shrimp a few ways ("Norfolk" style is oily for my taste, and I never had it growing up in Norfolk.)\n-Hawkins St Special\n-Prime Rib (sized for two, watch it)\n\nThe prices are low, the portions are large, and just about everything on the menu  is delicious. I\'m not one to pick a place because they give you a lot of food, but if you like a good value and don\'t want to compromise on taste, this place is a gem.
Emil's Lounge; Bars,American (New),Nightlife,Lounges,Restaurants;This place was very good. I found out about Emil\'s when watching a show called "25 Things I Love About Pittsburgh" on WQED hosted by Rick Seback. This place ain\'t a luxurious restaurant...it\'s a beer & a shot bar / lounge. But the people are friendly & the food is good. I had the fish sandwich which was great. It ain\'t in a great part of town, Rankin, but I\'ve been in worse places!! Try this place.'), 
Emil's Lounge; Bars,American (New),Nightlife,Lounges,Restaurants;Old school.....traditional "mom \'n pop" quality and perfection. The best fish and chips you\'ll ever enjoy and equally superb fried shrimp. A great out of the way, non-corporate, vestige of Americana. You will love it.'), 
Emil's Lounge; Bars,American (New),Nightlife,Lounges,Restaurants;Seen this restaurant on 25 best places in Pittsburgh with Rick Seback\nack. Went there with my girlfriend she grew up with the owner. She's very nice all employees are super nice service was excellent i had the fish sandwich my girlfriend had the Ruben more than you could possibly eat very reasonable prices. Going back to try the burgers  i heard there enormous and very tasty.")
Emil's Lounge; Bars,American (New),Nightlife,Lounges,Restaurants;Wonderful reuben.  Map shown on Yelp page is incorrect. It is actually a different Hawkins.  I'd recommend a call for directions 412-271-9911.
Emil's Lounge; Bars,American (New),Nightlife,Lounges,Restaurants;Good fish sandwich.
Emil's Lounge; Bars,American (New),Nightlife,Lounges,Restaurants;After a morning of Thrift Store hunting, a friend and I were thinking of lunch, and he suggested Emil's after he'd seen Chris Sebak do a bit on it and had tried it a time or two before, and I had not. He said they had a decent Reuben, but to be prepared to step back in time.\n\nWell, seeing as how I'm kind of addicted to late 40's and early 50's, and the whole Rat Pack scene, stepping back in time is a welcomed change in da burgh...as long as it doesn't involve 1979, which I can see all around me every day.\n\nAnd yet another shot at finding a decent Reuben in da burgh...well, that's like hunting the Holy Grail. So looking under one more bush certainly wouldn't hurt.\n\nSo off we go right at lunchtime in the middle of...where exactly were we? At first I thought we were lost, driving around a handful of very rather dismal looking blocks in what looked like a neighborhood that had been blighted by the building of a highway. And then...AHA! Here it is! And yep, there it was. This little unassuming building with an add-on entrance with what looked like a very old hand painted sign stating quite simply 'Emil's. \n\nWe walked in the front door, and entered another world. Another time, and another place. Oh, and any Big Burrito/Sousa foodies might as well stop reading now. I wouldn't want to see you walk in, roll your eyes and say 'Reaaaaaalllly?'\n\nThis is about as old world bar/lounge/restaurant as it gets. Plain, with a dark wood bar on one side, plain white walls with no yinzer pics, good sturdy chairs and actual white linens on the tables. This is the kind of neighborhood dive that I could see Frank and Dino pulling a few tables together for some poker, a fish sammich, and some cheap scotch. And THAT is exactly what I love.\n\nOh...but good food counts too. \n\nWe each had a Reuben, and my friend had a side of fries. The Reubens were decent, but not NY awesome. A little too thick on the bread, but overall, tasty and definitely filling. Not too skimpy on the meat. I seriously CRAVE a true, good NY Reuben, but since I can't afford to travel right now, what I find in da burgh will have to do. But as we sat and ate, burgers came out to an adjoining table. Those were some big thick burgers. A steak went past for the table behind us. That was HUGE! And when we asked about it, the waitress said 'Yeah, it's huge and really good, and he only charges $12.99 for it, ain't that nuts?' Another table of five came in, and wham. Fish sandwiches PILED with breaded fish that looked amazing. Yeah, I want that, that, that and THAT!\n\nMy friend also mentioned that they have a Chicken Parm special one day of the week that is only served UNTIL 4 pm, and that it is fantastic. If only I could GET there on that week day before 4...\n\nThe waitress did a good job, especially since there was quite a growing crowd at lunchtime on a Saturday, and only one of her. She kept up and was very friendly. \n\nThey only have Pepsi products, so I had a brewed iced tea, which was very fresh, and she did pop by to ask about refills as often as she could. As the lunch hour went on, they were getting busy.\n\nEmil's is no frills, good portions, very reasonable prices, VERY comfortable neighborhood hole in the wall...kind of like Cheers, but in a blue collar neighborhood in the 1950's. Fan-freakin-tastic! I could feel at home here.\n\nYou definitely want to hit Mapquest or plug in your GPS though. I am not sure that I could find it again on my own...it really is a hidden gem. I will be making my friend take me back until I can memorize where the heck it is.\n\nAddendum: 2nd visit for the fish sandwich. Excellent. Truly. A pound of fish on a fish-shaped bun (as opposed to da burgh's seemingly popular hamburger bun). The fish was flavorful, the batter excellent, and for just $8. This may have been the best fish sandwich I've yet to have in da burgh.")
Emil's Lounge; Bars,American (New),Nightlife,Lounges,Restaurants;This is a hidden gem, no really. It took us forever to find but well worth it. It is right across the street from the Rankin Police Station. The menu has a wide selection, I really couldn't decide what I wanted but I went with the ribeye sandwich. I'm glad i did too. Huge sandwich! I added mushrooms, it was very flavorful. My boyfriend got the fish sandwich, he enjoyed it as well. Fast and friendly service. Will definitely be back.
Emil's Lounge; Bars,American (New),Nightlife,Lounges,Restaurants;From reading the other reviews, I see this place was on some top 25 places in Pittsburgh list a few years ago.  I haven't seen it myself, but have known of this place for a while before my first visit in 2013.  It wasn't until my almost 80yo buddy, Mr. Italo Donatucci (world's coolest old Italian dude) brought me one of the best fish sandwiches I ever had that I became hooked!  I've had at least 10 since then, but only during the Lent season.  I gave my 5 rating based on the fish sandwich alone.  Try it without a bun also!  Either way you get 3 nice size pieces of fish equal to a pound.  You can have your choice of sides, but I always get the small mac n cheese for my side.  The staff is always really friendly and service is prompt.  It's in a rough neighborhood, but the Rankin police station is right across the street.  Almost every visit there I have seen police officers inside mingling with the locals or picking up lunch orders.  Soon I plan to make a visit that's not a Friday during Lent to try other menu items.
Emil's Lounge; Bars,American (New),Nightlife,Lounges,Restaurants;Another divey place we have been going to for years. My dad's favorite, as he knows the original owners. Certain items on the menu are named after the kids. Huge portions, might have a bit of a wait some nights. Huge burgers, fish sandwiches, salads. Decent service."), 
